Header 1,Header 2,Question,Answer,Paraphrases
"LLM을 학습한 추출 모델, 작아도 위험은 동일",,"특정 도메인에 최적화된 소형 모델(sLM)을 개발하기 위해 LLM을 '교사 모델'로 활용하는 지식 증류(Knowledge Distillation) 과정에서, 유용한 능력은 전이시키면서도 저작권 데이터, 개인정보, 편향성과 같은 유해한 정보의 전이는 선택적으로 차단할 수 있는 '안전한 증류' 메커니즘을 어떻게 설계할 수 있을까요? 예를 들어, 교사 모델의 로짓(logit)을 직접 활용하는 대신 특정 레이어의 중간 표현(intermediate representation)을 필터링하여 전달하는 방식의 효과와 그 구현상의 난점은 무엇일까요?","답변: 대규모 언어 모델(LLM)의 지식을 특정 도메인에 최적화된 소형 모델(sLM)로 이전하는 지식 증류(Knowledge Distillation) 기술의 확산은 모델의 접근성과 효율성을 높이는 데 크게 기여하고 있습니다. 그러나 이 과정에서 교사 모델이 학습한 유용한 능력뿐만 아니라, 저작권 데이터, 개인정보, 사회적 편향과 같은 유해하거나 민감한 정보까지 학생 모델에 무분별하게 전이되는 '위험의 상속' 문제가 핵심적인 기술적 과제로 부상했습니다. 따라서 유용한 지식은 보존하면서도 유해 정보의 전이는 선택적으로 차단하는 '안전한 증류(Safe Distillation)' 메커니즘을 설계하는 것은, 신뢰할 수 있는 AI 시스템 구축을 위한 필수적인 연구 분야로 그 중요성이 매우 크다고 할 수 있습니다.

전통적인 로짓 기반 증류 방식은 교사 모델의 최종 예측 확률 분포를 학생 모델이 모방하도록 학습시키므로, 결과값에 함축된 모든 종류의 지식과 편향을 필터링 없이 그대로 전달하는 한계가 있습니다. 이에 대한 대안으로, 교사 모델의 특정 중간 레이어에서 추출한 표현(intermediate representation)을 필터링하여 전달하는 접근법은 이론적으로 더 정교한 제어 가능성을 제공합니다. 이 방식은 모델의 하위 레이어에서는 보편적이고 추상적인 언어 특징을, 상위 레이어로 갈수록 구체적이고 특정 지식에 가까운 정보를 처리한다는 가정에 기반합니다. 이를 통해 유해 정보가 주로 인코딩된 것으로 추정되는 특정 레이어의 표현을 식별하고 해당 정보의 전이를 약화시키거나 차단함으로써, 학생 모델이 유용한 일반화 능력 위주로 학습하도록 유도할 수 있습니다. 하지만 이 방식의 구현에는 명확한 난점이 존재하는데, 첫째로 유용성과 유해성을 지닌 표현이 신경망 내에서 복잡하게 얽혀 있어 이를 명확히 분리(disentanglement)하는 것이 기술적으로 매우 어렵습니다. 둘째, 특정 표현을 차단하는 과정에서 의도치 않게 연관된 유용한 지식까지 함께 손실되어 학생 모델의 전반적인 성능이 저하되는 심각한 트레이드오프 문제가 발생할 수 있습니다.

결론적으로 교사 모델의 중간 표현을 활용한 선택적 증류는 안전한 sLM 개발을 위한 유망한 경로를 제시하지만, 그 실효성을 확보하기 위해서는 선결 과제가 많습니다. 이 메커니즘의 성공은 단순히 특정 레이어를 선택하는 수준을 넘어, 모델의 내부 표현을 해석하고 유해 정보와 관련된 활성화 패턴을 정확히 식별하는 해석 가능성(interpretability) 연구의 발전에 크게 의존합니다. 따라서 향후 연구는 유해 정보와 유용 정보의 신경망 내 인코딩 방식을 규명하고, 두 정보 간의 얽힘을 최소화하며 특정 개념을 정교하게 제거하거나 수정하는 '모델 수술(model surgery)'과 같은 근본적인 기술을 개발하는 방향으로 나아가야 할 것입니다. 이러한 기술적 진보가 이루어질 때 비로소 우리는 LLM의 막대한 잠재력을 안전하게 소형화하여 다양한 응용 분야에 확산시킬 수 있을 것입니다.

지식 증류 과정에서 발생하는 '위험의 상속' 문제는 LLM의 유용성을 안전하게 소형 모델로 이전하는 데 있어 핵심적인 기술적 장벽으로 작용한다. 이를 해결하기 위해 교사 모델의 중간 표현을 활용하는 접근법이 제시되었으나, 유해 정보와 유용 정보가 신경망 내부에 복잡하게 얽혀 있어 선택적 차단에 근본적인 어려움이 따른다. 따라서 향후 연구는 모델 내부 표현에 대한 해석 가능성을 높여 유해 정보의 인코딩 방식을 규명하고, 이를 정교하게 제어하여 성능 저하를 최소화하는 기술 개발에 집중해야 한다. 이러한 기술적 성숙은 신뢰할 수 있는 소형 AI 모델의 광범위한 보급을 위한 필수 전제 조건이 된다.","['LLM을 교사 모델로 사용하여 sLM에 지식을 증류할 때, 교사 모델의 핵심 능력은 전수하되 편향, 저작권 데이터, 개인정보와 같은 유해 요소는 어떻게 걸러낼 수 있을까요? 예를 들어, 최종 로짓 대신 특정 중간 레이어의 표현을 선별적으로 활용하는 방식은 어떤 효과와 기술적 과제를 가질까요?', ""LLM에서 sLM으로 지식을 이전하는 과정에서 성능 저하 없이 저작권, 편향 등 원치 않는 정보의 전이만 막는 '선별적 지식 전이' 방법론을 어떻게 구축할 수 있을까요? 교사 모델의 중간 레이어 표현을 필터링하여 학생 모델에 전달하는 방식의 장단점과 기술적 난이도는 어떠한가요?"", ""대규모 교사 모델의 지식을 소형 학생 모델로 증류할 때, 개인정보나 편향성과 같은 유해 정보를 정제하고 순수한 능력만 이전하는 메커니즘을 어떻게 설계할 수 있을까요? 교사 모델의 로짓 대신 중간 표현을 선별적으로 활용하는 접근법이 이러한 '지식 정제' 과정에서 갖는 이점과 기술적 어려움은 무엇인가요?"", ""지식 증류 시 교사 LLM의 최종 출력(로짓) 대신 특정 중간 레이어의 표현을 필터링해 sLM에 전달하는 방식을 생각해봅시다. 이 방법이 저작권이나 편향 같은 불필요한 정보는 걸러내고, 핵심적인 능력만 전이시키는 '안전한 증류' 목표에 얼마나 효과적이며, 구현하는 데 있어 주요 난관은 무엇일까요?""]"
"LLM을 학습한 추출 모델, 작아도 위험은 동일",,"추출된 소형 모델의 위험성을 정량적으로 평가하고 관리하기 위한 프레임워크를 어떻게 구축할 수 있을까요? 원본 LLM의 위험성(e.g., 특정 기밀 정보 발화 확률)과 추출된 모델의 위험성을 비교 측정하는 표준화된 벤치마크 설계 방안, 그리고 모델 크기, 학습 데이터 수, 증류 기법에 따라 위험 전이 효율성이 어떻게 변화하는지를 분석하기 위한 실험 설계 시 고려해야 할 핵심 변수는 무엇일까요?","답변: 추출된 소형 모델의 잠재적 위험성을 정량적으로 평가하고 체계적으로 관리하기 위한 프레임워크 구축은 책임감 있는 AI 기술 확산을 위한 핵심 과제입니다. 대형 언어 모델(LLM)의 지식을 증류하여 생성된 소형 모델은 접근성과 효율성 측면에서 큰 장점을 가지지만, 원본 모델이 내포한 편향성, 유해성, 기밀 정보 발설과 같은 위험까지 답습할 수 있다는 점에서 새로운 안전성 검증의 필요성을 제기합니다. 따라서 원본 모델과 추출 모델의 위험성을 객관적으로 비교하고, 위험이 전이되는 메커니즘을 심층적으로 분석할 수 있는 표준화된 평가 체계를 수립하는 것은 기술의 안전한 활용을 위한 필수적인 선결 조건이라 할 수 있습니다.

이를 위해 가장 먼저 설계해야 할 것은 '표준화된 위험성 비교 벤치마크'입니다. 이 벤치마크는 특정 기밀 정보 발화, 사회적 편향 발현, 유해 콘텐츠 생성 등 명확하게 정의된 위험 시나리오를 재현하도록 설계된 '위험 유발 프롬프트 셋(Risk-Inducing Prompt Set)'을 핵심 구성 요소로 합니다. 원본 LLM과 추출 모델에 동일한 프롬프트 셋을 입력하여, 각 모델의 응답을 정량적으로 평가하는 것입니다. 예를 들어, 특정 기밀 정보의 '정확 재현율(Exact Reproduction Rate)'이나 편향성 측정 도구를 통한 '편향 점수(Bias Score)'를 산출하여 두 모델의 위험 수준을 직접 비교할 수 있습니다. 이 결과를 바탕으로 '위험 전이 효율성(Risk Transfer Efficiency)', 즉 원본 모델의 위험성이 추출 모델에 얼마나 효과적으로 전이되었는지를 (추출 모델 위험 점수 / 원본 모델 위험 점수)와 같은 수식으로 계산하여 객관적인 지표로 삼아야 합니다.

다음으로, 위험 전이 효율성에 영향을 미치는 핵심 변수들을 통제하고 분석하기 위한 정교한 실험 설계가 요구됩니다. 첫째, '추출 모델의 크기(Model Size)'는 가장 중요한 변수로서, 파라미터 수가 감소함에 따라 위험성 발현 확률이 비선형적으로 변화하는 양상을 파악해야 합니다. 둘째, '증류 학습 데이터의 양과 구성(Volume and Composition of Distillation Data)' 역시 핵심적인 고려사항입니다. 적은 양의 데이터로 증류했을 때와 대량의 데이터로 증류했을 때의 위험 전이율 차이, 그리고 원본 모델의 유해한 응답을 정제한 '안전한' 데이터셋을 사용했을 때 위험 전이가 효과적으로 억제되는지를 검증해야 합니다. 셋째, '적용된 증류 기법(Distillation Technique)'에 따른 차이를 분석해야 합니다. 원본 모델의 로짓(logit) 값을 모방하는 전통적인 지식 증류 방식과 단순히 응답 텍스트만을 학습하는 방식 간에 위험성 전이 패턴이 어떻게 다른지를 비교 분석하여, 특정 기법이 안전성 측면에서 더 우월한지를 밝혀내야 합니다.

결론적으로, 추출된 소형 모델의 위험성을 관리하기 위한 프레임워크는 표준화된 벤치마크를 통한 정량적 위험 측정과 핵심 변수에 기반한 체계적인 실험 설계를 두 축으로 구성됩니다. 이러한 프레임워크는 특정 소형 모델이 배포되기에 충분히 안전한지를 판단하는 기준을 제공할 뿐만 아니라, 더 나아가 위험 전이를 최소화하는 '안전 지향적 증류 전략(Safety-Oriented Distillation Strategy)'을 개발하는 데 핵심적인 통찰력을 제공할 것입니다. 이를 통해 우리는 모델의 성능과 효율성을 추구하는 동시에, AI 기술이 사회에 미칠 수 있는 부정적 영향을 통제하고 신뢰를 구축하는 중요한 기반을 마련할 수 있습니다.

이처럼 정량적 벤치마크와 체계적 실험 설계를 결합한 프레임워크는 모델 추출 과정에서 발생하는 위험을 막연한 우려가 아닌 측정 가능한 과학적 분석의 영역으로 이끈다. 이를 통해 개발자들은 모델 크기, 학습 데이터, 증류 기법 등 설계 변수들이 안전성에 미치는 영향을 예측하고, 위험 전이를 사전에 최소화하는 최적의 조합을 도출할 수 있다. 궁극적으로 이러한 접근법은 효율적인 소형 모델의 광범위한 보급과 AI 기술의 사회적 신뢰 확보라는 두 가지 목표를 동시에 달성하기 위한 필수적인 기술적 토대를 제공할 것이다.","['원본 LLM의 유해성이 추출된 경량 모델로 얼마나 전이되는지 정량적으로 분석하고 제어하기 위한 방법론을 어떻게 개발할 수 있을까요? 이를 위해 원본과 추출 모델 간의 위험성을 상대적으로 평가할 벤치마크를 설계하는 방안과, 모델 규모, 데이터셋 크기, 증류 방식에 따라 위험 전이도가 어떻게 달라지는지 분석하는 실험에서 핵심적으로 다뤄야 할 요인은 무엇일까요?', '파생된 소형 모델의 보안 취약점을 계량적으로 평가하고 완화하기 위한 프레임워크를 어떻게 구성할 수 있습니까? 구체적으로 원본 LLM과 파생 모델의 위험성(e.g., 기밀 정보 발화 가능성)을 공통의 척도로 비교 측정할 벤치마크를 고안하고, 모델의 크기, 학습 데이터의 양, 그리고 증류 전략이 위험 전달 효율성에 미치는 영향을 체계적으로 분석하기 위한 실험의 주요 변수는 무엇이 되어야 할까요?', '원본 LLM으로부터 소형 모델을 추출할 때 발생하는 위험을 정량적으로 측정하고 관리하는 프레임워크를 만들기 위해, 원본과 추출된 모델의 위험도(e.g., 특정 기밀 정보 발화율)를 비교하는 표준 테스트를 어떻게 설계해야 하며, 모델 사이즈·학습 데이터 수·증류 기법의 변화가 위험 전이 효율에 주는 영향을 분석하는 실험에서 핵심 파라미터는 무엇으로 설정해야 할까요?']"
"LLM을 학습한 추출 모델, 작아도 위험은 동일",,"LLM 자체를 '추출 저항적'으로 만들기 위한 새로운 학습 방법론이나 아키텍처 변경 가능성은 없을까요? 예를 들어, 특정 정보에 대한 응답을 생성할 때 의도적으로 노이즈를 추가하거나, 응답의 일관성을 미세하게 저해하여 지식 증류의 효율을 떨어뜨리는 '데이터 오염(Data Poisoning)' 기법을 방어적으로 적용하는 연구 방향의 실효성과, 이로 인한 모델의 정상적인 성능 저하(utility-privacy trade-off)를 최소화할 방안은 무엇일까요?","답변: 대규모 언어 모델(LLM)의 지식 자산을 보호하기 위한 '추출 저항적(extraction-resistant)' 학습 방법론에 대한 논의는 모델의 상업적 가치와 지적 재산권 보호가 중요해짐에 따라 매우 시의적절하고 중요한 연구 주제입니다. 특히 모델의 응답에 의도적으로 노이즈를 주입하거나 미세한 비일관성을 추가하여 지식 증류(Knowledge Distillation)의 효율을 저해하는 방어적 데이터 오염(Defensive Data Poisoning) 기법은 이론적으로 충분한 잠재력을 가집니다. 이는 공격자가 탈취 모델을 학습시키기 위해 수집하는 대량의 출력 데이터셋의 품질을 근본적으로 저하시켜, 동일한 성능의 모델을 복제하기 위해 훨씬 더 많은 쿼리를 요구하도록 만들어 공격의 비용 효율성을 급격히 떨어뜨리는 원리입니다. 이 접근법은 모델의 근본적인 아키텍처 변경 없이 적용 가능하며, API를 통해 제한적으로 모델과 상호작용하는 블랙박스 환경의 공격자에게 특히 효과적일 수 있습니다.

이러한 방어 기법의 실효성을 확보하고 정상적인 성능 저하를 최소화하기 위해서는 정교한 기술적 접근이 요구됩니다. 핵심은 모든 응답에 무차별적으로 노이즈를 적용하는 것이 아니라, '조건부' 또는 '표적화'된 방식으로 방어 메커니즘을 활성화하는 것입니다. 예를 들어, 사용자의 쿼리 패턴을 실시간으로 분석하여 비정상적으로 광범위한 주제에 대해 체계적으로 질문하거나, 동일한 프롬프트에 미세한 변형을 가해 반복적으로 질의하는 등 모델 추출로 의심되는 행위를 탐지할 때만 방어적 오염 기법을 적용할 수 있습니다. 또한, 모델의 핵심 지식 자산으로 간주되는 특정 도메인(예: 금융 분석, 의료 진단)에 대한 응답에만 미세한 논리적 오류나 데이터 왜곡을 선택적으로 주입하고, 일반적인 대화 능력에는 영향을 주지 않는 방식도 가능합니다. 이는 사용자가 거의 인지할 수 없는 수준의 변화를 통해 지식 증류 과정에 사용되는 소프트 레이블(soft labels)의 신뢰도를 효과적으로 훼손하면서도, 일반 사용자의 경험은 최대한 보존하는 전략입니다.

결론적으로, LLM을 추출 저항적으로 만들기 위한 방어적 데이터 오염 기법은 유망한 연구 방향이지만, 그 성공은 유용성과 보안 간의 균형(utility-security trade-off)을 얼마나 잘 맞추느냐에 달려 있습니다. 이를 위해 공격 행위 탐지 기술과 연동된 동적 방어 메커니즘을 고도화하고, 모델의 핵심 자산과 일반 기능을 구분하여 방어 전략을 차등 적용하는 접근이 필수적입니다. 더 나아가 응답에 추적 가능한 워터마크를 삽입하는 기술과 결합한다면, 추출을 어렵게 만들 뿐만 아니라 사후 적발과 증거 확보까지 가능한 다층적 방어 체계를 구축할 수 있을 것입니다. 이러한 연구는 AI 기술의 지속 가능한 발전을 위해 반드시 필요한 보안 기반을 마련하는 데 기여할 수 있습니다.

결론적으로, LLM을 추출 저항적으로 만들기 위한 방어적 데이터 오염 기법은 유용성과 보안 간의 균형을 정교하게 조율해야 하는 과제를 안고 있는 유망한 연구 방향입니다. 이를 위해 공격 행위 탐지 기술과 연동된 동적 방어 메커니즘을 고도화하고, 모델의 핵심 자산과 일반 기능을 구분하여 방어 전략을 차등 적용하는 접근이 필수적이다. 더 나아가 응답에 추적 가능한 워터마크를 삽입하는 기술과 결합한다면, 추출을 어렵게 만들 뿐만 아니라 사후 적발과 증거 확보까지 가능한 다층적 방어 체계를 구축할 수 있을 것이다. 이러한 연구는 AI 기술의 지속 가능한 발전을 위해 반드시 필요한 보안 기반을 마련하는 데 기여할 수 있다.","['거대 언어 모델이 학습한 데이터의 추출을 방지하기 위해, 학습 방법론이나 아키텍처 자체를 어떻게 수정할 수 있을까요?', 'LLM의 답변에 의도적으로 노이즈를 추가하거나 일관성을 저해하는 방어적 기법을 적용할 때, 모델의 유용성 저하를 최소화하면서 지식 추출을 효과적으로 막을 수 있는 방안은 무엇인가요?', ""지식 증류 같은 추출 공격에 대응하기 위해 LLM에 '방어적 데이터 오염'을 적용하는 연구의 실현 가능성은 어느 정도이며, 이로 인한 프라이버시-성능 간의 상충 관계는 어떻게 해결할 수 있습니까?"", '모델의 유용성을 최대한 보존하면서 학습 데이터 추출에 대한 저항성을 갖도록 LLM을 설계하거나 훈련하는 새로운 패러다임이 존재할 수 있을까요?']"
"LLM을 학습한 추출 모델, 작아도 위험은 동일",,"추출된 소형 모델은 크기가 작고 특정 유해 기능에 고도로 특화될 수 있다는 점에서 기존의 대규모 모델 기반 공격과는 다른 새로운 위협 시나리오를 야기합니다. 이러한 소형 모델이 엣지 디바이스나 분산 환경에 배포되어 탐지를 회피하는 '지능형 지속 위협(APT)'의 일부로 활용될 경우, 이를 탐지하고 대응하기 위한 기존 보안 아키텍처(e.g., SIEM, EDR)는 어떻게 보완되어야 할까요? 모델의 출처를 추적하기 위한 '모델 워터마킹(Model Watermarking)' 기술의 현재 한계점과 이를 극복하기 위한 연구 방향은 무엇이 있을까요?","답변: LLM으로부터 추출된 소형 모델이 야기하는 새로운 보안 위협, 특히 지능형 지속 위협(APT)의 일환으로 활용될 가능성은 기존 보안 체계에 대한 근본적인 재검토를 요구합니다. 크기가 작고 특정 목적에 고도로 최적화된 이들 모델은 엣지 디바이스나 분산 환경에 은밀하게 배포되어 장기간 잠복하며 악의적 행위를 수행할 수 있습니다. 이는 기존의 시그니처 기반 탐지나 네트워크 트래픽 이상 감지에 의존하는 보안 정보 및 이벤트 관리(SIEM), 엔드포인트 탐지 및 대응(EDR) 솔루션의 탐지 범위를 우회할 수 있음을 의미하며, AI 모델 자체의 행위를 분석하고 그 출처를 규명하는 새로운 방어 전략의 필요성을 시사합니다.

이러한 새로운 위협에 대응하기 위해 기존 보안 아키텍처는 AI 모델의 행위 자체를 분석하는 방향으로 보완되어야 합니다. 구체적으로, EDR 솔루션은 엔드포인트에서 실행되는 프로세스의 메모리나 연산 패턴을 분석하여 비정상적인 AI 모델 추론(inference) 행위를 식별하는 기능을 탑재해야 합니다. 예를 들어, 특정 모델이 시스템 API를 호출하여 민감 정보에 접근하거나, 외부 통신을 위한 코드를 동적으로 생성하는 등의 행위 패턴을 'AI 행위 기반 위협 인텔리전스'로 정의하고 이를 탐지하는 것입니다. SIEM은 개별 엔드포인트에서 수집된 이러한 AI 모델 행위 로그를 중앙에서 종합적으로 분석하여, 분산된 여러 소형 모델이 조직적으로 수행하는 고도화된 공격 시나리오를 재구성하고 그 연관성을 파악하는 역할을 수행해야 합니다. 이는 단순 로그 수집을 넘어, AI 모델의 입출력 데이터와 내부 동작 메커니즘에 대한 깊은 이해를 바탕으로 한 새로운 상관관계 분석 규칙의 도입을 필요로 합니다.

모델의 출처를 추적하여 악의적 행위의 근원을 파악하는 모델 워터마킹 기술은 중요한 해결책으로 제시되지만, 현재 명확한 한계점을 가지고 있습니다. 현재의 워터마킹 기술은 주로 모델의 출력값에 특정 통계적 편향을 삽입하는 방식으로 구현되는데, 이는 미세조정(Fine-tuning), 가지치기(Pruning), 지식 증류(Knowledge Distillation)와 같은 모델 변형 기술에 매우 취약합니다. 공격자는 추출한 모델을 자신의 목적에 맞게 추가 학습하거나 경량화하는 과정에서 원본 모델의 워터마크를 의도치 않게 혹은 의도적으로 손상시키거나 제거할 수 있습니다. 이를 극복하기 위한 연구는 워터마크가 모델의 출력층이 아닌, 파라미터 공간 자체에 깊숙이 내재되어 모델의 핵심 기능과 분리될 수 없도록 만드는 강건한(robust) 워터마킹 기법에 초점을 맞추고 있습니다. 또한, 암호학적 기법을 활용하여 모델의 소유권을 증명하거나, 여러 개의 워터마크를 중첩하여 일부가 손상되어도 출처 추적이 가능하도록 하는 다중 워터마킹 연구도 활발히 진행되고 있습니다.

결론적으로, 추출된 소형 AI 모델을 활용한 지능형 위협은 방어 체계의 패러다임 전환을 요구하는 심각한 도전 과제입니다. 이에 대응하기 위해서는 기존 SIEM, EDR과 같은 보안 솔루션을 AI 행위 분석 중심으로 고도화하고, 동시에 모델 변형 공격에도 강건하게 유지되는 차세대 워터마킹 기술을 개발하여 모델의 생성부터 배포, 사용에 이르는 전 과정에 대한 추적성과 책임성을 확보해야 합니다. 이러한 다층적인 기술적, 정책적 노력이 결합될 때 비로소 우리는 AI가 야기하는 새로운 보안 위협에 효과적으로 대처하고 신뢰할 수 있는 AI 생태계를 구축할 수 있을 것입니다.

추출된 소형 AI 모델을 활용한 지능형 위협은 기존 보안 체계의 탐지를 우회하므로 방어 패러다임의 근본적인 전환을 촉구한다. 이에 대응하기 위해서는 SIEM, EDR과 같은 보안 솔루션을 AI 행위 분석 중심으로 고도화하고, 모델 변형 공격에도 강건하게 유지되는 차세대 워터마킹 기술 개발이 병행되어야 한다. 이러한 다층적인 기술적 접근은 모델의 생성부터 사용까지 전 과정에 대한 추적성과 책임성을 확보함으로써, 진화하는 AI 위협에 대응하고 신뢰할 수 있는 AI 생태계를 구축하는 핵심 기반이 된다.","['특정 악성 기능에 맞춰 작게 경량화된 AI 모델이 분산 시스템에 숨어 APT 공격을 수행하는 시나리오에 대응하기 위해, 현재의 보안 인프라(SIEM, EDR 등)는 어떤 기능적 보강이 필요합니까? 이와 더불어, 모델의 원본을 식별하는 워터마킹 기법이 현재 마주한 한계점들과 이를 해결할 혁신적인 접근법은 무엇이 있습니까?', '지능형 지속 위협(APT)의 일환으로 소형화된 AI 모델이 탐지를 피해 엣지 기기에서 작동할 때, 기존의 SIEM, EDR과 같은 보안 솔루션은 어떻게 진화해야만 이 위협을 무력화할 수 있습니까? 그리고 모델의 소유권 추적 기술인 워터마킹의 실용성을 저해하는 제약들은 무엇이며, 이를 극복할 유망한 연구 분야는 어디일까요?']"
