Header 1,Header 2,Question,Answer,Paraphrases
,,"(라우팅 및 부하 분산)** 현재 MoE 모델에서 사용되는 Top-k 게이팅 기반 라우팅 전략이 특정 유형의 토큰(예: 코드, 비전 데이터)에 편중되는 현상을 어떻게 완화할 수 있을까요? 토큰의 모달리티(modality) 특성을 반영한 동적 라우팅(dynamic routing) 알고리즘을 설계한다면, 전문가 간 로드 밸런싱과 전문가 특화(specialization) 사이의 최적 트레이드오프 지점은 어디일까요?","답변: 현재 MoE(Mixture-of-Experts) 모델에서 널리 사용되는 Top-k 게이팅 기반 라우팅 전략은 특정 유형의 토큰, 예를 들어 코드나 비전 데이터와 같은 특정 모달리티에 대한 전문가 편중 현상을 야기하여 모델의 효율성과 성능을 저해하는 주요 원인으로 지목됩니다. 이러한 편중은 특정 전문가에게 계산 부하를 집중시켜 라우팅 병목 현상을 유발하고, 다른 전문가들의 활용도를 저하시켜 전체 모델의 잠재력을 완전히 이끌어내지 못하게 만듭니다. 따라서, 다양한 데이터 모달리티를 효율적으로 처리하면서도 전문가 간의 부하를 균등하게 분배하는 고도화된 라우팅 메커니즘의 설계는 차세대 대규모 MoE 모델의 핵심적인 연구 과제라 할 수 있습니다.

이러한 문제를 완화하기 위해 토큰의 모달리티 특성을 명시적으로 반영하는 동적 라우팅 알고리즘을 설계할 수 있습니다. 기존의 Top-k 게이팅이 주로 토큰의 의미적 임베딩에만 의존했다면, 제안되는 알고리즘은 '모달리티 식별 메커니즘'을 라우팅 과정에 통합합니다. 예를 들어, 게이팅 네트워크의 입력으로 토큰 임베딩과 함께 해당 토큰이 텍스트, 코드, 이미지 중 어떤 유형에 속하는지를 나타내는 원핫 인코딩된 모달리티 벡터를 추가로 제공하는 방식입니다. 더 나아가, 훈련 과정에서 특정 모달리티의 토큰이 소수의 전문가에게 집중되는 것을 방지하기 위해 '모달리티 기반 부하 분산 손실(modality-aware load balancing loss)' 항을 전체 손실 함수에 추가할 수 있습니다. 이 손실 항은 각 모달리티별로 전문가 선택 분포의 엔트로피를 최대화하도록 유도하여, 특정 유형의 토큰이 여러 관련 전문가에게 고르게 분산되도록 강제함으로써 ‘핫스팟’ 현상을 효과적으로 억제합니다.

전문가 간 로드 밸런싱과 전문가 특화 사이의 최적 트레이드오프 지점은 고정된 값이 아니라, 태스크의 복잡성과 데이터 분포에 따라 동적으로 결정되는 평형점(equilibrium)에 가깝습니다. 이 최적점은 전문가 특화를 통해 얻는 성능 향상의 한계 이익(marginal gain)이 부하 불균형으로 인해 발생하는 시스템 효율성 저하의 한계 비용(marginal cost)과 일치하는 지점입니다. 앞서 제안한 모달리티 기반 부하 분산 손실의 가중치(hyperparameter)를 조절함으로써 이 균형점을 탐색할 수 있습니다. 가중치를 높이면 로드 밸런싱을 우선시하여 시스템 처리량을 극대화하는 방향으로, 가중치를 낮추면 전문가가 특정 모달리티에 깊이 특화되도록 허용하여 특정 태스크에서의 정확도를 높이는 방향으로 모델을 유도할 수 있습니다. 결국 이 트레이드오프는 MoE 아키텍처를 정적 라우팅 시스템에서 벗어나, 다양한 데이터 스트림에 지능적으로 적응하고 자원을 효율적으로 재분배하는 자기조절 시스템으로 발전시키는 핵심적인 설계 고려사항입니다.

이처럼 모달리티 정보를 명시적으로 활용하는 동적 라우팅 및 부하 분산 손실 함수는 기존 MoE 모델의 전문가 편중 문제를 해결하는 효과적인 방안을 제시합니다. 이러한 접근법은 전문가 특화와 시스템 효율성 사이의 미세한 균형을 조절할 수 있는 수단을 제공하여, 모델이 다양한 데이터 유형에 지능적으로 적응하도록 돕습니다. 결과적으로 이는 MoE 아키텍처가 복잡하고 이질적인 데이터 환경에서 잠재력을 온전히 발휘하고, 대규모 모델의 실용성을 한 단계 끌어올리는 핵심적인 진전으로 평가될 수 있다.","['MoE 모델의 Top-k 게이팅이 코드나 비전 데이터 같은 특정 토큰을 선호하는 문제를 해결하기 위해, 토큰의 모달리티를 고려한 동적 라우팅을 도입한다면, 어떻게 전문가들의 부하를 균등하게 유지하면서 동시에 각 전문가의 전문성을 극대화할 수 있을까요?', 'MoE 모델에서 토큰의 모달리티(코드, 비전 등)를 인식하는 동적 라우팅을 통해 기존 Top-k 게이팅의 편중 문제를 개선하고자 할 때, 전문가 부하 분산과 전문가 전문성 강화라는 상충하는 두 목표 사이의 이상적인 절충점은 무엇일까요?', '기존 Top-k 라우팅 방식이 특정 토큰 유형(예: 코드, 비전)에 치우치는 불균형을 해소하기 위해 토큰의 모달리티 정보를 활용하는 동적 라우팅을 도입한다면, 전문가 간 작업 부하를 균등하게 분산시키는 것과 각 전문가를 특정 분야에 특화시키는 것 사이의 최적의 균형점을 어떻게 설계해야 할까요?', '현재 MoE 모델의 Top-k 라우팅이 보이는 특정 모달리티 토큰(코드, 비전)으로의 쏠림 현상을 완화시키기 위해 토큰 속성을 반영한 적응형 라우팅을 적용할 때, 전문가 네트워크 전반의 부하 균형과 개별 전문가의 전문화 수준 사이에서 최적의 트레이드오프를 달성하기 위한 전략은 무엇입니까?']"
,,"(시스템 및 추론 최적화)** MoE 아키텍처의 파라미터 수는 방대하지만 추론 시 활성화되는 파라미터는 일부입니다. 서비스 배포 관점에서, 비활성 전문가(inactive experts)를 효율적으로 관리하기 위한 메모리 오프로딩(offloading) 또는 스와핑(swapping) 전략은 무엇이 있을까요? 특히, 실시간 추론 지연 시간(inference latency)에 미치는 영향을 최소화하면서 GPU 메모리 사용량을 최적화할 수 있는 시스템 레벨의 설계 방안은 무엇일까요?","답변: MoE(Mixture-of-Experts) 아키텍처의 효율적인 서비스 배포는 모델의 총 파라미터 규모와 실제 추론 시 활성화되는 파라미터 간의 불일치를 시스템 레벨에서 어떻게 해결하는가에 달려 있습니다. 방대한 비활성 전문가(inactive experts)를 GPU 메모리에 상주시키는 것은 심각한 자원 낭비로 이어지며, 이는 곧 서비스 운영 비용의 증가와 직결됩니다. 따라서 실시간 추론 지연 시간을 최소화하면서 GPU 메모리 사용량을 최적화하는 것은 대규모 MoE 모델을 경제적으로 배포하고 확장하기 위한 필수적인 기술적 과제이며, 이를 해결하기 위한 정교한 메모리 관리 전략이 요구됩니다.

이 문제에 대한 가장 효과적인 시스템 설계 방안은 게이팅 네트워크(gating network)의 예측을 활용한 ‘예측 기반 비동기 프리페칭(predictive asynchronous pre-fetching)’ 전략입니다. 추론 요청이 발생하면, 토큰을 처리하는 전체 전문가 레이어 연산에 앞서 경량의 게이팅 네트워크가 먼저 실행되어 활성화될 전문가를 예측합니다. 시스템은 이 예측 정보를 바탕으로, 현재 GPU 메모리에 없는 전문가 파라미터를 시스템 RAM이나 NVMe SSD와 같은 보조 저장 장치로부터 미리 로딩하기 시작합니다. 이 데이터 전송 과정은 이전 토큰의 다른 레이어 연산과 병렬적으로 수행되므로, 데이터 로딩으로 인한 지연 시간을 연산 시간 뒤에 효과적으로 은닉(hide)할 수 있습니다. 또한, 전문가의 사용 빈도를 추적하는 LRU(Least Recently Used)와 같은 캐싱 정책을 결합하여, 자주 사용되는 ‘핫(hot)’ 전문가는 GPU VRAM에 최대한 상주시키고 사용 빈도가 낮은 ‘콜드(cold)’ 전문가는 선택적으로 오프로딩하는 계층적 메모리 관리 체계를 구축함으로써 전반적인 시스템 효율을 극대화할 수 있습니다.

결론적으로, MoE 모델의 비활성 전문가를 효율적으로 관리하기 위한 핵심은 예측, 비동기, 그리고 계층화에 있습니다. 게이팅 네트워크의 예측을 활용해 필요한 전문가를 선제적으로 로딩하고, 이 과정을 다른 연산과 중첩시켜 지연 시간을 최소화하며, 전문가 사용 빈도에 기반한 계층적 캐싱 전략을 통해 GPU 메모리 효율을 최적화하는 하이브리드 접근 방식이 가장 유효합니다. 이러한 시스템 레벨의 최적화는 단순히 하드웨어 요구사항을 낮추는 것을 넘어, 거대 언어 모델의 배포 장벽을 낮추고 AI 서비스의 경제성과 확장성을 확보하는 데 결정적인 역할을 수행합니다.
.

이처럼 게이팅 네트워크의 예측을 활용한 선제적 로딩, 연산-통신 중첩을 통한 지연 시간 은닉, 그리고 사용 빈도 기반의 동적 캐싱 전략을 통합하는 접근 방식은 MoE 모델 배포의 고질적인 비효율성을 해결하는 가장 실용적인 해법입니다. 이는 모델의 전체 파라미터 규모와 실제 서빙에 필요한 GPU VRAM 요구사항 사이의 강한 결합을 끊어내어, 제한된 하드웨어 자원으로도 더 큰 모델을 서비스할 수 있는 가능성을 열어줍니다. 궁극적으로 이러한 시스템 수준의 최적화는 대규모 언어 모델의 운영 비용을 절감하고 배포 장벽을 낮춤으로써 AI 기술의 경제적 타당성과 확장성을 확보하는 핵심 기반이 된다.","['MoE 모델의 희소한 전문가 활성화 패턴을 활용하여, 실시간 추론 레이턴시를 유지하면서 비활성 전문가를 오프로딩/스와핑함으로써 GPU 메모리 부담을 줄일 수 있는 시스템 아키텍처는 어떻게 설계할 수 있나요?', '서비스 환경에서 MoE 모델을 배포할 때, 추론에 사용되지 않는 방대한 수의 전문가 파라미터를 GPU 메모리에서 오프로딩하거나 스와핑하는 전략을 어떻게 구현해야 실시간 레이턴시 페널티를 최소화하고 메모리 사용량을 최적화할 수 있습니까?']"
,,"(멀티모달 융합 아키텍처)** 멀티모달 MoE에서, 텍스트와 이미지 임베딩을 동일한 전문가 네트워크 집합으로 라우팅하는 것이 최선일까요, 아니면 모달리티별 전용 전문가(modality-specific experts) 그룹을 두는 것이 더 효과적일까요? 후자의 경우, 서로 다른 모달리티의 정보를 융합(fusion)하는 레이어를 어느 시점에, 어떤 방식으로 추가해야 모델의 고차원적 추론 능력을 극대화할 수 있을까요?","답변: 멀티모달 대형 언어 모델(LLM)의 추론 능력을 극대화하기 위한 아키텍처 설계는 AI 연구의 핵심 과제로 부상하고 있습니다. 특히 Mixture-of-Experts(MoE) 구조 내에서 텍스트와 이미지 같은 이종(heterogeneous) 데이터를 처리하는 방식은 모델의 성능을 결정짓는 중요한 변수입니다. 단일 전문가 네트워크 풀을 공유하는 방식과 모달리티별 전용 전문가 그룹을 두는 방식 사이의 선택은 모델의 효율성과 전문성 사이의 근본적인 트레이드오프를 반영합니다. 고차원적이고 복합적인 추론을 요구하는 과업에서는 각 데이터의 고유한 특성을 심도 있게 처리하는 능력이 필수적이므로, 최적의 융합 전략을 수립하는 것은 모델이 진정한 의미의 멀티모달 이해에 도달하기 위한 필수 관문이라 할 수 있습니다.

본 보고서의 분석에 따르면, 텍스트와 이미지 임베딩을 위해 모달리티별 전용 전문가(modality-specific experts) 그룹을 구성하는 것이 고차원적 추론 능력 확보에 더 효과적입니다. 텍스트 데이터는 순차적 구조와 문법적 관계가 중요하며, 이미지 데이터는 공간적 계층 구조와 픽셀 간의 지역적 상관관계가 핵심입니다. 이처럼 각 모달리티는 고유한 통계적 특성과 처리 방식을 요구하므로, 공유 전문가 네트워크는 두 모달리티의 특징을 모두 평균적으로 학습하려다 어느 한쪽의 미세한 특징도 제대로 포착하지 못하는 '간섭 현상'을 야기할 수 있습니다. 반면, 전용 전문가 그룹은 각 모달리티에 최적화된 방식으로 심층적인 특징 추출을 수행하여, 후속 융합 단계에 더 정제되고 풍부한 정보를 제공할 수 있습니다. 이는 파라미터 수가 증가하는 단점에도 불구하고, 모델이 각 데이터의 본질을 깊이 있게 이해하는 기반을 마련해 주기 때문에 최종적인 추론 성능에서 우위를 점하는 핵심 요인으로 작용합니다.

모달리티별 전문가를 활용할 경우, 정보 융합 레이어의 위치와 방식은 추론 능력 극대화에 결정적인 영향을 미칩니다. 분석 결과, 융합 시점은 초기(early fusion)나 최종(late fusion) 단계보다는, 각 모달리티가 충분히 독립적으로 처리된 후인 모델의 중간(mid-level) 혹은 심층(deep) 레이어에 배치하는 것이 가장 효과적입니다. 초기 융합은 각 모달리티의 고유한 정보가 충분히 추출되기 전에 혼합되어 정보 손실을 야기할 수 있고, 최종 융합은 두 정보 간의 복잡하고 긴밀한 상호작용을 학습할 기회를 제한합니다. 따라서 각 모달리티별 인코더 블록을 여러 층 통과시킨 후, 생성된 고차원 표상(representation)을 융합하는 것이 바람직합니다. 융합 방식으로는 단순한 연결(concatenation)이나 합산(summation)을 넘어, 한 모달리티의 정보를 쿼리(Query)로 사용하여 다른 모달리티의 정보(Key, Value)에서 필요한 부분을 선택적으로 가져오는 교차-어텐션(cross-attention) 메커니즘이 가장 강력한 성능을 보입니다.

결론적으로, 멀티모달 MoE 아키텍처에서 고차원적 추론 능력을 최대화하기 위한 최적의 전략은 모달리티별 전용 전문가 그룹을 통해 각 데이터의 특성을 깊이 있게 인코딩하고, 모델의 중간 또는 후반부 레이어에서 교차-어텐션 기반의 융합 메커니즘을 적용하는 것입니다. 이러한 구조는 각 정보의 전문성을 보존하면서도 두 정보 간의 유기적이고 맥락적인 관계를 효과적으로 학습할 수 있게 합니다. 이는 단순히 데이터를 병합하는 수준을 넘어, 하나의 모달리티가 다른 모달리티를 해석하는 단서가 되게 함으로써, 이미지에 대한 복잡한 질문에 답하거나 텍스트 지시를 시각적으로 구현하는 등 인간과 유사한 수준의 복합 추론을 가능하게 하는 핵심 기술적 토대를 제공한다는 점에서 중요한 시사점을 가집니다.

따라서 멀티모달 MoE 아키텍처의 고차원적 추론 능력은 모달리티별 전용 전문가 그룹을 통해 각 데이터의 특성을 심층적으로 인코딩하고, 모델의 중간 이후 레이어에서 교차-어텐션 기반으로 정보를 융합할 때 가장 효과적으로 발현된다. 이러한 설계는 각 모달리티의 전문성을 보존하면서 데이터 간의 복잡하고 유기적인 상호작용을 학습할 수 있는 최적의 환경을 제공한다. 결과적으로 이는 단순한 정보의 결합을 넘어, 하나의 모달리티가 다른 모달리티의 해석을 위한 단서로 작용하게 함으로써 인간과 유사한 수준의 복합적인 추론을 가능하게 하는 핵심 기반을 마련한다.","['멀티모달 MoE 구조에서, 텍스트와 이미지 표현을 공통 전문가 풀로 보내야 할까요, 아니면 각 모달리티를 위한 별도의 전문가 그룹을 구성해야 할까요? 후자를 선택한다면, 모델의 복합적인 추론 성능을 최적화하기 위해 이들의 정보를 어느 단계에서 어떤 메커니즘으로 통합해야 할까요?', 'MoE 기반 멀티모달 아키텍처 설계 시, 모든 모달리티 임베딩을 단일 전문가 집합에 할당하는 방식과 텍스트와 이미지 각각에 특화된 전문가를 두는 방식 중 어느 것이 더 우수한가요? 만약 후자 접근법을 택한다면, 고수준의 추론 능력을 확보하기 위해 모달리티 간 정보 결합은 모델의 어느 깊이에서 어떤 방식으로 이루어져야 할까요?', '멀티모달 MoE의 라우팅 전략으로, 텍스트와 이미지 임베딩에 대해 공유 전문가(shared experts)를 사용하는 것과 모달리티 특화 전문가(modality-specific experts)를 사용하는 것 중 어느 쪽이 더 효과적인가요? 모달리티 특화 전문가를 쓸 경우, 최상의 추론 성능을 이끌어내기 위한 최적의 정보 융합 시점과 방법은 무엇인가요?', '다중 모달 MoE 모델의 추론 능력을 최대화하기 위해, 텍스트와 이미지 정보를 하나의 전문가 집합으로 처리하는 것이 좋을까요, 아니면 각기 다른 전문가 그룹에 할당하는 것이 좋을까요? 전문가 그룹을 분리한다면, 이종 모달리티 간의 정보를 언제, 어떻게 결합해야 가장 좋은 성능을 기대할 수 있나요?']"
,,"(훈련 안정성 및 전문가 특화)** MoE 모델 훈련 시 발생하는 로드 불균형(load imbalance) 문제를 해결하기 위해 보조 손실 함수(auxiliary loss function)를 사용합니다. 이 보조 손실의 가중치(weight)가 전문가의 특화 수준과 훈련 안정성에 미치는 민감도(sensitivity)는 어느 정도이며, 이를 훈련 과정에서 동적으로 조절하는 스케줄링 기법이 최종 모델 성능에 어떤 영향을 미칠까요?","답변: MoE(Mixture of Experts) 모델의 훈련 과정에서 보조 손실 함수(auxiliary loss function)의 가중치 설정은 모델의 최종 성능과 직결되는 핵심적인 요소입니다. 이 가중치는 전문가 네트워크(expert network)의 부하 분산을 통한 훈련 안정성 확보와 각 전문가의 역할 특화를 통한 성능 극대화라는 상충 관계(trade-off)를 직접적으로 제어하기 때문입니다. 따라서 해당 가중치의 민감도를 정밀하게 분석하고, 이를 효과적으로 제어하는 동적 스케줄링 기법의 영향을 이해하는 것은 MoE 아키텍처의 잠재력을 최대한 활용하기 위한 필수적인 연구 과제라 할 수 있습니다.

보조 손실의 가중치는 전문가 특화 수준과 훈련 안정성에 매우 높은 민감도를 보입니다. 가중치를 높게 설정할 경우, 라우팅 네트워크는 토큰을 여러 전문가에게 강제로 균등하게 분배하게 되어 로드 밸런싱을 효과적으로 달성할 수 있습니다. 이는 특정 전문가에게 연산이 집중되는 현상을 막아 훈련 과정의 전반적인 안정성을 크게 향상시키는 장점이 있습니다. 그러나 이러한 강제적 균등 분배는 각 전문가가 특정 영역에 대한 깊이 있는 전문성을 갖추는 것을 방해하여, 결과적으로 모든 전문가가 유사한 역할을 수행하는 동질적인(homogeneous) 상태로 수렴하게 만들 수 있습니다. 반대로 가중치를 낮게 설정하면, 라우터가 가장 적합하다고 판단하는 전문가에게 토큰을 자유롭게 보낼 수 있어 전문가의 특화 수준을 극대화할 수 있지만, 소수의 인기 있는 전문가에게만 부하가 집중되는 '전문가 붕괴(expert collapse)' 현상을 야기하여 심각한 훈련 불안정성을 초래할 위험이 있습니다.

이러한 민감도를 고려할 때, 훈련 과정 전반에 걸쳐 고정된 가중치를 사용하는 대신 이를 동적으로 조절하는 스케줄링 기법은 최종 모델 성능에 긍정적인 영향을 미칩니다. 일반적으로 훈련 초기에는 비교적 높은 가중치를 설정하여 모든 전문가가 다양한 데이터에 노출되고 기본적인 역할을 학습하도록 유도함으로써 훈련 안정성을 확보합니다. 이후 훈련이 진행됨에 따라 점진적으로 가중치를 낮추는 어닐링(annealing) 스케줄링을 적용하면, 각 전문가는 점차 자신에게 가장 적합한 데이터에 집중하며 세분화된 전문성을 발전시킬 수 있습니다. 이처럼 훈련 단계에 따라 안정성과 특화 사이의 균형점을 동적으로 이동시키는 전략은, 고정된 가중치 방식에 비해 더 안정적인 수렴을 유도하고 각 전문가의 잠재력을 최대한 이끌어내어 최종적으로 더 높은 성능의 모델을 구현하는 핵심적인 기법으로 작용합니다.

MoE 모델에서 보조 손실 가중치는 훈련 안정성 확보와 전문가 특화라는 상충된 목표를 조율하는 핵심적인 역할을 수행합니다. 고정된 값으로는 훈련 전 과정에 걸쳐 최적의 균형을 유지하기 어렵기 때문에, 훈련 단계에 따라 가중치를 동적으로 조절하는 스케줄링 기법이 더욱 효과적인 전략으로 간주됩니다. 결과적으로 이러한 정교한 제어 방식은 훈련 실패의 위험을 줄이는 동시에 각 전문가의 잠재력을 최대한 이끌어내어 모델의 최종 성능을 극대화하는 데 필수적이다.","['MoE 모델의 로드 불균형 해소를 위해 사용하는 보조 손실 함수의 중요도는 전문가 전문화 및 훈련 안정성과 어떤 관계를 가지나요? 또한, 훈련 중 이 중요도를 스케줄링하는 것이 최종 모델 성능에 미치는 영향은 무엇입니까?', 'Mixture of Experts 모델 학습 시, 부하 분산을 위한 보조 손실 가중치 값의 변화가 전문가의 전문화 수준과 학습 안정성에 각각 어떻게 작용하나요? 이 가중치를 동적으로 스케줄링하는 전략은 최종 모델의 성능을 얼마나 개선할 수 있습니까?', 'MoE 아키텍처 훈련에서 부하 불균형 문제를 완화하는 보조 손실 항의 계수 값에 따라 전문가 특화와 훈련 안정성은 얼마나 달라지나요? 그리고 이 계수를 훈련 페이즈에 맞춰 동적으로 조절하는 기법은 모델의 최종적인 성능 지표에 어떤 변화를 가져오나요?', 'MoE 모델 훈련 시 특정 전문가로의 쏠림 현상을 방지하는 보조 손실의 가중치를 어떻게 설정하는 것이 전문가 분화와 훈련 안정성에 가장 유리한가요? 더 나아가, 이 가중치를 고정하지 않고 학습 과정에 따라 조절하는 스케줄링 방식이 최종 모델의 성능에 실질적으로 어떤 이점을 제공하나요?']"
