Header 1,Header 2,Question,Answer,Paraphrases
잊어버려야 할 것은 잊는 LLM이 필요한 시점,LLM에서 상태가 유지되지 않는 이유,"현재 Transformer 아키텍처는 근본적으로 상태 비저장(Stateless) 방식입니다. 대화의 핵심 정보를 지속적으로 유지하고 불필요한 정보는 점진적으로 잊는 '상태 저장(Stateful) LLM'을 구현한다고 가정했을 때, 우리는 어떤 기술적 접근을 우선적으로 고려해야 할까요? 예를 들어, RNN의 개념을 되살린 아키텍처(e.g., RWKV)를 도입하는 것과, 별도의 외부 벡터 메모리(External Vector Memory)를 활용해 상태를 관리하고 이를 모델과 상호작용시키는 방식 중 어떤 접근이 확장성, 추론 속도, 그리고 '선택적 망각' 기능 구현 측면에서 더 유리할까요?","답변: 보고서에서 지적한 바와 같이, 현재 API 기반의 트랜스포머 아키텍처는 근본적으로 상태 비저장(Stateless) 특성을 가지며, 이는 장기적인 대화 연속성을 확보하는 데 주요한 기술적 제약으로 작용합니다. 일관된 문맥을 유지하고 불필요한 정보는 점진적으로 망각하는 진정한 의미의 '상태 저장(Stateful) LLM' 구현은 차세대 AI 애플리케이션의 핵심 과제입니다. 이 목표를 달성하기 위한 기술적 접근법으로, RNN의 개념을 차용하여 아키텍처 자체에 상태를 내재화하는 방식과, 외부 벡터 메모리를 활용하여 상태를 독립적으로 관리하고 모델과 상호작용시키는 모듈식 접근을 비교 분석하는 것은 매우 중요합니다.

기술적 관점에서 두 접근은 명확한 장단점을 보입니다. RWKV와 같이 RNN의 원리를 계승한 아키텍처는 순차적 데이터 처리와 상태 벡터 업데이트를 통해 이론적으로 무한한 길이의 문맥을 처리할 수 있으며, 전체 기록을 재입력할 필요가 없어 추론 속도에서 이점을 가질 수 있습니다. 하지만 고정된 크기의 상태 벡터에 모든 과거 정보를 압축해야 하므로, 중요한 정보가 희석되거나 오래된 정보가 불필요하게 남아 '선택적 망각'을 정교하게 제어하기 어렵다는 본질적 한계가 있습니다. 반면, 보고서에서 암시된 '별도로 관리하는 메모리 시스템', 즉 외부 벡터 메모리를 활용하는 접근은 확장성 및 선택적 망각 기능 구현에 있어 훨씬 유리합니다. 메모리의 크기가 모델의 컨텍스트 창과 무관하게 확장될 수 있으며, RAG(Retrieval-Augmented Generation)와 유사한 메커니즘을 통해 현재 대화와 가장 관련성 높은 정보만을 선별적으로 검색하여 모델에 제공할 수 있기 때문입니다. 이는 시간 기반 감쇠, 요약, 관련성 점수화 등 정교한 망각 알고리즘을 적용할 수 있는 유연성을 제공하지만, 매 요청마다 검색 과정이 추가되어 추론 지연이 발생할 수 있다는 단점을 가집니다.

결론적으로, 단기적인 추론 속도에서는 아키텍처 기반 접근이 일부 우위를 보일 수 있으나, 장기적인 확장성, 유지보수성, 그리고 핵심 과제인 '선택적 망각'의 정교한 구현 측면에서는 외부 벡터 메모리를 활용하는 방식이 더욱 현실적이고 강력한 해법입니다. 이 접근법은 LLM의 핵심 연산과 장기 기억을 분리함으로써, 각 모듈을 독립적으로 최적화하고 고도화할 수 있는 유연성을 부여합니다. 따라서 향후 상태 저장 LLM의 발전은 모델 아키텍처의 근본적인 혁신보다는, LLM과 외부 메모리 시스템 간의 효율적인 상호작용을 설계하고, 문맥의 중요도를 동적으로 판단하여 기억을 재구성하는 정교한 메모리 관리 기술을 개발하는 방향으로 집중될 가능성이 높습니다.

결론적으로, 단기적인 추론 속도에서는 아키텍처 기반 접근이 일부 우위를 보일 수 있으나, 장기적인 확장성, 유지보수성, 그리고 핵심 과제인 '선택적 망각'의 정교한 구현 측면에서는 외부 벡터 메모리를 활용하는 방식이 더욱 현실적이고 강력한 해법입니다. 이 접근법은 LLM의 핵심 연산과 장기 기억을 분리함으로써, 각 모듈을 독립적으로 최적화하고 고도화할 수 있는 유연성을 부여합니다. 따라서 향후 상태 저장 LLM의 발전은 모델 아키텍처의 근본적인 혁신보다는, LLM과 외부 메모리 시스템 간의 효율적인 상호작용을 설계하고 문맥의 중요도를 동적으로 판단하여 기억을 재구성하는 정교한 메모리 관리 기술을 개발하는 방향으로 집중될 가능성이 높습니다.","['기존 트랜스포머의 상태 비저장 한계를 극복하고, 중요 정보는 유지하되 불필요 정보는 잊는 상태 저장 LLM을 만든다면, RWKV 같은 RNN 기반 아키텍처와 외부 벡터 메모리 활용 방식 중 확장성, 추론 속도, 선택적 망각 기능 면에서 어느 것이 더 나은 선택일까요?', '장기 대화 기억을 위해 상태 저장 LLM을 구현할 때, RWKV처럼 모델 구조 자체에 순환성을 부여하는 방법과, 외부 벡터 메모리를 통해 상태를 관리하는 방법 중 확장 가능성, 추론 속도, 그리고 정보의 선택적 폐기 기능 구현에 더 적합한 접근법은 무엇인가요?', '대화의 맥락을 지속적으로 기억하면서 오래된 정보는 선별적으로 제거하는 상태 저장 LLM을 설계한다고 가정해 봅시다. 아키텍처를 RWKV처럼 RNN 방식으로 수정하는 것과 외부 벡터 메모리를 연동하는 방식 중, 모델 규모 확장, 실시간 추론 성능, 선택적 망각 기능 구현의 효율성 측면에서 어떤 기술 전략이 더 우월한가요?', '상태 저장 LLM이 대화의 핵심은 보존하고 나머지는 점진적으로 망각하게 하려면, RWKV와 같이 아키텍처 내부에 상태를 기록하는 순환적 접근법과 외부에 벡터 메모리를 두는 분리된 접근법 중, 확장성, 추론 속도, 그리고 효과적인 망각 메커니즘 구현을 위해 어떤 방향을 우선적으로 탐색해야 할까요?']"
잊어버려야 할 것은 잊는 LLM이 필요한 시점,LLM에서 상태가 유지되지 않는 이유,2. [알고리즘] '기계 학습에서의 삭제(Machine Unlearning)' 관점에서 망각의 정확성과 성능 보존 사이의 트레이드오프를 최소화하는 방법은?,"답변: 기계 학습 모델에서 특정 정보를 선택적으로 제거하는 '기계 학습에서의 삭제(Machine Unlearning)'는 모델의 성능 저하를 최소화하면서 망각의 정확성을 높여야 하는 중요한 과제입니다. 제시된 보고서는 API 기반 LLM의 상태 비유지(stateless) 특성이 이러한 트레이드오프를 어떻게 심화시키는지 보여줍니다. 모델이 요청 간 메모리를 유지하지 못하고, 개발자가 매번 대화 기록 전체를 수동으로 전달해야 하는 구조는 본질적으로 '망각'의 책임을 모델이 아닌 애플리케이션에 전가합니다. 따라서 이 구조에서 망각의 정확성과 성능 보존 사이의 균형을 맞추는 것은 대화 기록을 어떻게 재구성하여 모델에 전달하는지에 따라 결정되며, 이는 매우 정교한 접근을 요구하는 문제입니다.

보고서에서 지적하듯, 현재의 API 기반 LLM은 과거 메시지를 명시적으로 포함하지 않으면 문맥을 이해하지 못합니다. 여기서 트레이드오프를 최소화하는 방법은 '외부 메모리 시스템의 지능화'에서 찾을 수 있습니다. 단순히 대화 기록이 길어졌다고 해서 오래된 순서대로 삭제하거나 임의로 요약하는 방식은 보고서가 경고하는 '중요한 세부 정보 생략'이나 '오래된 문맥 의존' 문제를 야기할 수 있습니다. 이를 해결하기 위해서는 대화의 중요도, 최신성, 주제 관련성 등을 종합적으로 평가하여 다음 프롬프트에 포함할 메시지를 동적으로 선별하는 알고리즘이 필요합니다. 예를 들어, 사용자의 핵심 질문이나 시스템의 중요 지침과 같은 정보는 대화가 길어져도 유지하고, 일시적이거나 부수적인 정보는 과감히 삭제하여 문맥의 밀도를 높이는 방식이 효과적인 성능 보존 전략이 될 수 있습니다.

결론적으로, 제시된 본문에 근거할 때, 현재의 상태 비유지 LLM 환경에서 망각의 정확성과 성능 보존의 트레이드오프를 최소화하는 현실적인 해법은 모델 자체의 알고리즘 개선이 아닌, 애플리케이션 단에서의 지능적인 문맥 재구성 능력에 달려 있습니다. 이는 각 API 호출 시 전달되는 'messages' 배열을 단순한 대화 기록의 나열이 아닌, 핵심 정보를 압축하고 정제한 '전략적 기억'으로 설계하는 것을 의미합니다. 결국 효과적인 외부 메모리 관리 시스템을 통해 필요한 정보는 보존하고 불필요한 정보는 정확히 잊도록 유도하는 것이 성능 저하를 막고 일관성 있는 응답을 생성하는 핵심 방안이 될 것입니다.

상태 비유지 LLM의 구조적 한계 속에서 망각의 정확성과 성능 보존을 양립시키는 해법은 모델 외부의 지능적인 메모리 관리에서 찾아야 합니다. 이는 대화 기록을 단순히 시간순으로 전달하는 것을 넘어, 정보의 중요도와 문맥적 관련성을 동적으로 평가하여 각 요청에 최적화된 기억을 선별하는 접근이 필요함을 시사합니다. 궁극적으로 이러한 전략적 문맥 제어는 성능 저하를 막고 선택적 망각을 구현함으로써, 모델 응답의 일관성과 신뢰도를 확보하는 가장 현실적인 방안입니다.","['머신 언러닝에서 특정 데이터의 망각 효과는 극대화하면서 모델의 전반적인 성능 저하를 방지하려면 어떤 접근법이 필요한가요?', 'Machine Unlearning 기술 적용 시, 데이터 삭제의 효과를 보장하는 동시에 모델의 기존 성능을 최대한 보존하기 위한 전략은 무엇입니까?', '기계 학습 모델에서 특정 정보를 성공적으로 제거하면서도, 전체적인 예측 정확도나 유용성을 해치지 않을 방법은 무엇인가요?', '머신 언러닝 과정에서 삭제 데이터에 대한 망각의 완전성과 남아있는 데이터에 대한 모델 성능 유지 사이의 상충 관계를 어떻게 해결할 수 있을까요?']"
잊어버려야 할 것은 잊는 LLM이 필요한 시점,LLM에서 상태가 유지되지 않는 이유,"학습 데이터셋에서 특정 정보를 제거하기 위해 전체 모델을 재학습하는 것은 비용이 매우 큽니다. 특정 사용자 데이터나 편향된 정보를 모델의 가중치에서 '수술적으로' 제거하는 가장 효율적인 방법은 무엇일까요? 가령, 특정 개념과 관련된 뉴런의 활성화를 억제하는 방식, 역전파(backpropagation)를 이용해 특정 데이터의 기여도를 상쇄하는 방식 등을 고려할 때, '망각의 정확성(forgetting accuracy)'과 '기존 성능 보존(retaining general performance)' 사이의 트레이드오프를 최소화할 수 있는 실험적 설계는 어떻게 구성할 수 있을까요?","답변: 제시된 보고서 본문은 API 기반 LLM이 본질적으로 상태를 유지하지 못하는(stateless) 구조적 한계를 지적하며, 이는 대화의 맥락을 유지하기 위해 매번 과거 기록을 명시적으로 전달해야 하는 번거로움과 비효율을 야기합니다. 이러한 맥락적 망각 문제는 더 근본적인 질문, 즉 모델의 가중치에 영구적으로 각인된 특정 정보를 어떻게 선택적으로 '잊게' 할 것인가라는 과제로 이어집니다. 전체 모델을 재학습하는 방식은 막대한 시간과 컴퓨팅 자원을 소모하므로, 개인정보 보호, 편향성 제거, 저작권 문제 해결 등을 위해 특정 데이터를 외과적으로 제거하는 '기계 학습 망각(Machine Unlearning)' 기술의 중요성이 부각되고 있습니다. 이는 단순히 대화 기록을 누락하는 차원을 넘어, 모델의 파라미터 자체를 수정하여 특정 지식의 흔적을 지우는 고도의 기술적 접근을 요구합니다.

이러한 목표를 달성하기 위한 가장 효율적인 방법론으로 특정 개념과 관련된 뉴런의 활성화를 억제하거나, 특정 데이터의 학습 기여도를 역전파(backpropagation)로 상쇄하는 방식이 유력하게 거론됩니다. 예를 들어, 특정 사용자 데이터와 강하게 연관된 뉴런 그룹을 식별한 뒤, 해당 뉴런들의 활성화 함수 출력을 인위적으로 낮추거나 연결 가중치를 조정하여 정보 표현을 약화시킬 수 있습니다. 또한, 망각 대상 데이터가 모델 학습에 미친 영향을 그래디언트(gradient)로 계산하고, 정확히 그 반대 방향의 그래디언트를 모델 가중치에 적용하여 학습 효과를 상쇄시키는 '그래디언트 기반 망각' 기법도 효과적입니다. 이러한 기법들의 핵심은 망각의 정확성과 기존 성능 보존 사이의 미묘한 균형을 맞추는 데 있으며, 이를 위한 정교한 실험 설계가 필수적입니다.

'망각의 정확성'과 '기존 성능 보존'의 트레이드오프를 최소화하는 실험적 설계를 위해서는, 먼저 명확한 평가 지표와 데이터셋을 구성해야 합니다. 첫째, '망각 대상 데이터셋(Forget Set)'에 대한 질의 시 모델이 관련 정보를 출력하지 못하는 정도를 측정하는 '망각 성공률'을 정의합니다. 둘째, 망각 대상과 개념적으로 유사하지만 보존해야 할 지식을 담은 '유지 데이터셋(Retain Set)'을 구축하여, 망각 과정에서 의도치 않은 지식 손실이 발생하는지 평가합니다. 셋째, 기존의 범용 벤치마크 데이터셋(e.g., MMLU, Hellaswag)을 활용하여 모델의 전반적인 추론 및 언어 능력 저하 여부를 측정합니다. 이러한 다각적인 평가 체계 하에서, 망각 기법의 강도(e.g., 역전파 학습률, 뉴런 억제 계수)를 점진적으로 조절하며 세 가지 지표의 변화를 모니터링함으로써, 범용 성능 저하를 최소화하면서 망각 성공률을 극대화하는 최적의 균형점을 탐색할 수 있습니다.

요약하자면, 기계 학습 망각 기술은 LLM의 재학습에 따르는 막대한 비용 없이 특정 정보를 선별적으로 제거하여 모델의 안전성과 신뢰성을 향상시키는 핵심적인 해결책으로 부상하고 있다. 제안된 망각, 유지, 범용 데이터셋을 활용한 다각적 평가 체계는 망각의 정확성을 확보하면서도 모델의 전반적인 성능 저하를 최소화해야 하는 기술적 난제를 해결하기 위한 체계적인 접근법을 제시한다. 이러한 정교한 검증 과정을 통해 특정 정보에 대한 통제력을 확보하는 것은 향후 책임감 있는 인공지능 개발의 필수적인 기반이 될 것이다.","[""전체 재학습을 피하면서 특정 데이터 포인트나 개념을 모델에서 선택적으로 제거하는 가장 효율적인 기계 학습 '망각(unlearning)' 기법은 무엇이며, 이 과정에서 발생하는 기존 성능 저하와 망각 정확도 간의 균형을 최적화하기 위한 실험은 어떻게 설계해야 할까요?"", ""특정 정보(사용자 데이터, 편향)를 모델 가중치에서 제거하는 여러 '모델 편집' 또는 '망각' 기법들을 비교 평가하고자 합니다. 망각의 성공률을 극대화하면서도 모델의 전반적인 예측 능력 손실을 최소화하는 최적의 접근법을 찾기 위해 어떤 비교 실험 프레임워크를 제안할 수 있습니까?"", '기학습된 모델의 일반화 성능을 최대한 보존하면서 특정 데이터의 영향을 효과적으로 제거해야 하는 과제가 있습니다. 전체 모델을 재학습하는 대신, 국소적 수정 방식을 사용할 때 이 두 상충하는 목표(성능 보존과 선택적 망각)를 가장 잘 조율할 수 있는 방법론과 그 검증 절차는 무엇일까요?', ""비용이 많이 드는 전체 재학습을 대체하여, 학습된 모델로부터 특정 데이터나 편향을 정밀하게 제거하는 경제적인 방법론이 필요합니다. 모델의 기존 지식은 손상시키지 않으면서 목표 정보만 성공적으로 '망각'했음을 검증하고, 이러한 효율적 망각을 달성하기 위한 최적의 알고리즘적 접근 방식은 무엇일까요?""]"
잊어버려야 할 것은 잊는 LLM이 필요한 시점,LLM에서 상태가 유지되지 않는 이유,3. [평가 및 검증] LLM이 특정 정보를 '성공적으로 잊었는지'를 정량적으로 검증할 평가 프로토콜은 어떻게 설계해야 하는가?,"답변: LLM(거대 언어 모델)이 특정 정보를 성공적으로 제거했는지 검증하는 평가 프로토콜의 설계는 모델의 신뢰성과 일관성을 확보하는 데 매우 중요합니다. 제시된 본문은 API 기반 LLM이 본질적으로 상태를 유지하지 않으며, 매 요청마다 제공되는 문맥(messages)에 전적으로 의존한다는 점을 명확히 하고 있습니다. 따라서 '잊음'에 대한 평가는 모델의 내부 상태 변화를 측정하는 것이 아니라, 통제된 문맥 조작을 통해 모델의 응답이 어떻게 변화하는지를 정량적으로 분석하는 방식으로 설계되어야 합니다. 이는 곧 애플리케이션 단에서 메모리 관리의 성공 여부를 평가하는 것과 동일한 의미를 지니며, 정보 유출 방지 및 문맥 오염 최소화를 위해 필수적인 검증 절차입니다.

본문을 근거로 한 정량적 평가 프로토콜은 '정보 주입-제거-검증'의 3단계로 구성할 수 있습니다. 첫째, '정보 주입' 단계에서는 검증하고자 하는 특정 정보(예: '프로젝트 A의 비밀 코드는 X-73이다')를 `messages` 배열에 명시적으로 포함하여 API를 호출하고, 모델이 해당 정보를 정확히 인지하고 있는지 확인하는 질문을 통해 기준선을 설정합니다. 둘째, '정보 제거' 단계에서는 후속 API 호출 시, 이전 대화 기록이 담긴 `messages` 배열에서 해당 정보가 포함된 부분을 의도적으로 삭제하거나 수정합니다. 이것이 본문에서 설명하는 '과거 메시지를 수동으로 전달'하는 과정에서 메모리를 제어하는 핵심적인 기술적 행위입니다. 셋째, '검증' 단계에서는 정보가 제거된 문맥을 바탕으로 모델에게 다시 한번 동일 정보에 대해 직접적(예: ""프로젝트 A의 비밀 코드는 무엇인가?"") 혹은 간접적(예: ""프로젝트 A에 대해 요약해줘"")으로 질문합니다. 성공적인 '잊음'은 모델이 ""모르겠다""고 응답하거나, 해당 정보를 포함하지 않은 채 답변을 생성하는 경우로 판단할 수 있습니다.

이러한 검증 과정을 정량화하기 위해 '재현 실패율(Recall Failure Rate)'이라는 지표를 도입할 수 있습니다. 예를 들어, 100번의 독립적인 테스트 세션을 구성하여 정보 주입 후 제거했을 때, 모델이 제거된 정보를 답변에 포함하지 않은 비율을 측정하는 방식입니다. 재현 실패율이 99% 이상일 경우, 설계된 메모리 관리 시스템이 효과적으로 작동하여 모델이 특정 정보를 성공적으로 '잊었다'고 정량적으로 판단할 수 있습니다. 또한, 응답의 일관성 점수를 측정하여 제거된 정보로 인해 모델의 다른 답변이 논리적으로 훼손되지는 않는지도 함께 평가해야 합니다. 이처럼 명시적인 문맥 제어와 결과 분석에 기반한 평가 프로토콜은 상태 비저장(stateless) LLM의 특성을 정확히 활용하여 정보 제거의 성공 여부를 객관적으로 검증하는 효과적인 방법론을 제시합니다.

이처럼 API 기반 LLM의 상태 비저장 특성을 활용한 평가 프로토콜은 정보 제거의 성공 여부를 객관적으로 측정하는 체계적인 접근법을 제시합니다. 이는 단순히 모델의 '잊음'을 확인하는 것을 넘어, 애플리케이션 수준에서 데이터 프라이버시를 보호하고 문맥 오염으로 인한 응답 품질 저하를 방지하는 실질적인 수단이 됩니다. 따라서 이러한 엄격한 검증 체계의 도입은 LLM 기반 애플리케이션의 안정성과 신뢰도를 제고하기 위한 필수적인 개발 과정으로 자리 잡아야 한다.","['대규모 언어 모델에서 특정 데이터가 효과적으로 제거되었는지 수치적으로 측정할 수 있는 평가 체계는 어떻게 구축해야 할까?', 'LLM의 머신 언러닝(machine unlearning) 성능을 정량적으로 평가하기 위한 방법론은 어떻게 수립할 수 있는가?', '언어 모델이 특정 지식을 성공적으로 망각했음을 계량적으로 확인할 수 있는 검증 절차는 무엇인가?', '특정 정보가 LLM에서 성공적으로 삭제되었는지를 수치 기반으로 증명하기 위한 평가 지표와 절차를 어떻게 마련해야 하는가?']"
