Header 1,Header 2,Question,Answer,Paraphrases
LLM 한계 극복을 위한 RAG의 역할과 최신 동향,"LLM의 문제 : 환각, 제한적인 컨텍스트","RAG 시스템의 환각 현상은 **'①잘못된 정보를 검색'**하는 경우와 **'②올바른 정보를 검색했으나 LLM이 잘못 생성'**하는 경우로 나눌 수 있습니다. 이 두 가지 실패 사례를 명확히 구분하고 정량적으로 측정하기 위한 효과적인 평가 프레임워크는 어떻게 설계할 수 있을까요? Ragas, ARES와 같은 최신 평가 프레임워크를 우리 내부 데이터셋과 서비스 특성에 맞게 커스터마이징할 때 가장 중요하게 고려해야 할 지표(e.g., Faithfulness, Answer Relevancy, Context Precision)는 무엇이며, **자동화된 평가의 신뢰도를 어떻게 확보**할 수 있을까요?","답변: RAG 시스템의 환각 현상을 유형별로 구분하고 정량적으로 측정하는 평가 프레임워크 설계는 LLM 서비스의 신뢰성 확보를 위해 매우 중요한 과제입니다. 제시된 본문은 RAG 시스템의 구체적인 평가 방법론보다는, LLM이 근본적으로 직면하는 환각 및 최신성 문제의 원인을 심도 있게 다루고 있습니다. 본문은 LLM이 훈련 데이터의 시점 한계로 인해 최신 정보가 부재할 경우, 과거의 무관한 데이터를 기반으로 답변을 꾸며내는 환각 현상을 핵심 문제로 지적합니다. 이는 RAG 시스템이 해결하고자 하는 근본적인 도전 과제를 명확히 보여주며, 신뢰할 수 있는 평가 프레임워크의 필요성을 역설적으로 강조합니다.

본문에 따르면, LLM의 한계는 단순히 최신 정보의 부재에서만 비롯되지 않습니다. 컨텍스트 창이 기술적으로 확장되더라도 '건초 더미에서 바늘 찾기' 문제처럼, 모델이 방대한 정보 속에서 필요한 핵심 사실을 정확히 찾아내지 못하는 현상이 발생할 수 있습니다. 이는 질문에서 언급된 '②올바른 정보를 검색했으나 LLM이 잘못 생성'하는 실패 사례의 근본 원인과 맞닿아 있습니다. 즉, 검색된 컨텍스트가 충분하더라도 LLM 자체의 정보 처리 능력 한계로 인해 환각이 발생할 수 있음을 시사합니다. 하지만 본문은 이러한 문제의 원인을 분석하는 데 초점을 맞출 뿐, Ragas나 ARES와 같은 프레임워크를 활용하여 검색(retrieval) 실패와 생성(generation) 실패를 구분하고, Faithfulness나 Context Precision과 같은 특정 지표를 통해 정량적으로 측정하는 방법론이나 자동화된 평가의 신뢰도 확보 방안에 대한 직접적인 해결책은 제시하지 않고 있습니다.

결론적으로, 제시된 문서는 LLM의 고질적인 한계인 환각과 제한된 컨텍스트 문제를 상세히 설명함으로써, RAG 시스템의 필요성을 명확히 부각합니다. 그러나 RAG 실패 사례를 '잘못된 정보 검색'과 '잘못된 생성'으로 명확히 구분하여 측정하고, 내부 서비스 특성에 맞게 평가 지표를 커스터마이징하는 구체적인 프레임워크 설계 방안에 대해서는 정보를 포함하고 있지 않습니다. 따라서 해당 질문에 대한 심층적인 답변을 도출하기 위해서는, 본문에 기술된 LLM의 근본적 한계에 대한 이해를 바탕으로 RAG 평가 방법론을 전문적으로 다루는 추가적인 기술 자료 분석이 요구됩니다.

제시된 문서는 LLM이 직면한 환각 및 최신성 문제의 근본 원인을 깊이 있게 분석함으로써 RAG 시스템 도입의 당위성을 효과적으로 역설한다. 그러나 검색 실패와 생성 실패를 구분하여 정량적으로 측정하고, 서비스 특성에 맞춰 평가 지표를 조정하는 실질적인 프레임워크 설계 방안에 대한 구체적인 내용은 다루지 않는다. 그러므로 신뢰성 높은 RAG 시스템을 구축하고 그 성능을 객관적으로 검증하기 위해서는, 본문의 분석을 토대로 Ragas와 같은 전문 평가 프레임워크에 대한 심도 있는 기술적 검토가 병행되어야만 한다.","[""RAG 시스템의 답변 오류를 '검색 실패'와 '생성 실패'로 나누어 각 원인별 기여도를 정량적으로 추적하는 평가 방법론은 어떻게 개발할 수 있을까요? Ragas나 ARES 같은 기존 프레임워크를 내부 서비스에 맞게 수정할 때 Faithfulness, Answer Relevancy 등 어떤 지표를 핵심으로 삼아야 하며, 자동화된 평가 결과의 신뢰도를 보장할 방안은 무엇인가요?"", ""RAG 파이프라인의 실패 지점을 '부정확한 컨텍스트 검색'과 '컨텍스트 기반 생성 오류'로 명확히 구분하여 측정하는 평가 체계 구축 방안이 궁금합니다. 우리 데이터와 서비스에 최적화된 평가를 위해 Ragas, ARES 등을 커스터마이징할 때 Context Precision, Faithfulness 같은 지표들의 우선순위는 어떻게 설정해야 하며, 자동 평가의 신뢰성은 어떻게 검증할 수 있을까요?"", ""'잘못된 문서를 가져오는 문제'와 '올바른 문서를 보고도 잘못 답하는 문제'라는 RAG의 두 가지 환각 유형을 독립적으로 평가하고 정량화하려면 어떤 프레임워크를 설계해야 할까요? Ragas, ARES 등을 활용하여 내부 데이터셋에 맞는 평가 시스템을 만들 때, 답변의 근거충실성, 관련성, 검색 정확도 중 무엇을 가장 중요한 지표로 삼아야 하며, 자동 평가 시스템 자체의 신뢰도를 높일 방법은 무엇인가요?"", '내부 데이터와 서비스 환경에 맞춰 RAG 평가 시스템을 구축하고자 합니다. 검색 단계의 오류와 생성 단계의 오류를 분리하여 정량적으로 파악하기 위한 효과적인 설계 방법은 무엇일까요? Ragas, ARES 같은 도구를 커스터마이징할 때 Faithfulness나 Answer Relevancy와 같은 핵심 지표를 어떻게 선정해야 하며, 자동화된 평가가 실제 성능을 정확히 반영하도록 보장하는 전략은 무엇이 있을까요?']"
LLM 한계 극복을 위한 RAG의 역할과 최신 동향,"LLM의 문제 : 환각, 제한적인 컨텍스트","단순한 'Retrieve-then-Read'를 넘어, 복잡한 질문에 대한 다단계 추론이 필요한 경우, 재귀적 검색(Recursive Retrieval)이나 적응형 검색(Adaptive Retrieval)과 같은 고급 RAG 기법을 어떻게 구현할 수 있을까요? 예를 들어, 첫 번째 검색 결과가 불충분하다고 판단하고 **LLM 스스로 추가적인 쿼리를 생성하여 검색을 반복하는 'Self-Correcting' 루프**를 설계할 때, 루프의 종료 조건은 어떻게 설정하며, 이 과정에서 발생하는 **비용 및 지연 시간 증가 문제를 어떻게 제어**할 수 있을까요?","답변: 제시된 본문에 따르면, LLM은 훈련 데이터의 시점적 한계로 인한 환각 현상과 제한된 컨텍스트라는 근본적인 문제에 직면합니다. 2024년까지 학습된 모델이 2025년 사건에 대해 부정확한 정보를 생성하거나, 컨텍스트 창이 방대하더라도 '건초 더미에서 바늘 찾기' 문제처럼 핵심 정보를 놓치는 현상은 단순한 정보 검색(Retrieve-then-Read) 방식의 한계를 명확히 보여줍니다. 따라서 복잡하고 다층적인 질문에 대해 신뢰도 높은 답변을 생성하기 위해서는, LLM이 스스로 정보의 충분성을 판단하고 능동적으로 추가 탐색을 수행하는 재귀적 또는 적응형 검색과 같은 고급 RAG 기법의 도입이 필수적이며, 이는 LLM의 추론 능력을 한 단계 발전시키는 핵심 과제라 할 수 있습니다.

이러한 고급 RAG 기법의 핵심인 'Self-Correcting' 루프를 설계할 때, 루프의 종료 조건과 비용 및 지연 시간 제어는 시스템의 효율성과 안정성을 위해 체계적으로 설정되어야 합니다. 루프의 종료 조건은 첫째, 초기 질문에 대해 수집된 정보가 충분하고 일관성 있는 답변을 생성하기에 적합하다고 모델 스스로 판단하는 경우, 둘째, 미리 설정된 최대 반복 횟수(예: 3~5회)나 총 처리 시간 제한을 초과하는 경우, 셋째, 추가적인 쿼리 생성이 더 이상 새롭거나 유의미한 정보를 가져오지 못하는 '수렴 상태'에 도달했다고 판단될 때로 설정할 수 있습니다. 비용 및 지연 시간 증가 문제는 쿼리 재구성이나 검색 결과의 중간 평가 같은 반복적인 작업에는 더 작고 빠른 모델(예: 경량화된 SLM)을 사용하고, 수집된 모든 정보를 종합하여 최종 답변을 생성하는 단계에서만 고성능의 대규모 모델을 활용하는 계층적 접근을 통해 효과적으로 제어할 수 있습니다. 또한, 동일한 하위 질문에 대한 검색 결과를 캐싱하여 불필요한 반복 검색을 방지하는 것도 중요한 최적화 전략입니다.

결론적으로, 명확한 종료 조건과 효율적인 자원 관리 전략을 갖춘 자기 교정적 검색 루프는 단순한 외부 정보 참조를 넘어 LLM에 다단계 추론 능력을 부여하는 핵심적인 구현 방식입니다. 이는 본문에서 지적한 LLM의 고질적인 한계, 즉 최신 정보 부재로 인한 환각과 방대한 정보 속에서 핵심을 파악하지 못하는 문제를 근본적으로 해결하는 실질적인 방안이 됩니다. 이러한 고급 RAG의 발전은 LLM을 단순한 정보 제공자를 넘어, 복잡한 문제에 대해 깊이 있는 분석과 신뢰도 높은 해결책을 제시하는 진정한 의미의 추론 엔진으로 진화시키는 데 결정적인 역할을 할 것입니다.

LLM의 환각 현상과 제한된 컨텍스트 처리 능력이라는 근본적인 한계는 자기 교정적 검색 루프를 포함한 고급 RAG 기술의 도입을 통해 극복될 수 있다. 이 기술은 모델이 스스로 정보의 충분성을 판단하고 능동적으로 추가 탐색을 수행하도록 함으로써, 답변의 신뢰도와 깊이를 획기적으로 향상시키고 다단계 추론을 가능하게 한다. 궁극적으로 이는 LLM을 단순한 정보 제공자를 넘어, 복잡한 문제에 대해 깊이 있는 분석과 신뢰도 높은 해결책을 제시하는 능동적 추론 엔진으로 진화시키는 결정적인 계기가 될 것이다.","['복합적인 질문에 답하기 위해 LLM이 스스로 추가 쿼리를 생성하며 검색을 반복하는 적응형 RAG를 구현할 때, 이 자동화된 검색 루프를 어떤 기준으로 중단시켜야 하며, 반복 과정에서 발생하는 비용과 응답 지연을 어떻게 관리할 수 있을까요?', ""LLM이 초기 검색 결과의 불충분함을 인지하고 스스로 후속 검색을 수행하는 'Self-Correcting' RAG 모델에서, 무한 루프를 방지하기 위한 최적의 종료 조건은 무엇이며, 이 반복적 과정으로 인한 비용 증가와 지연 시간 문제를 해결할 실질적인 방안은 무엇인가요?"", '다단계 추론이 필요한 질문에 대응하고자 LLM이 자율적으로 쿼리를 개선하며 재검색하는 고급 RAG 시스템을 설계할 경우, 이 순환적 검색 프로세스를 언제 멈추도록 설정해야 하며, 이로 인해 발생하는 리소스 소모와 성능 저하를 어떻게 제어해야 할까요?', '기본적인 RAG를 넘어, LLM이 정보가 부족하다고 판단 시 자동으로 추가 검색을 진행하는 재귀적 검색 루프를 만들 때, 이 반복을 멈추는 효과적인 조건은 무엇이며, 동시에 검색 횟수 증가에 따른 비용 및 속도 문제를 완화할 전략은 무엇이 있을까요?']"
LLM 한계 극복을 위한 RAG의 역할과 최신 동향,"LLM의 문제 : 환각, 제한적인 컨텍스트","검색된 컨텍스트의 양이 LLM의 컨텍스트 창(Context Window)을 초과하거나, 여러 문서에서 **상충되는 정보가 포함될 경우** LLM의 성능이 저하되는 '정보 과부하(Information Overload)' 및 '신뢰도 혼란(Confidence Confusion)' 문제를 어떻게 완화할 수 있을까요? 컨텍스트 압축(Context Compression) 기법의 효과, Prompt Engineering을 통한 LLM의 역할 지정(e.g., '주어진 문서만을 근거로 답변하라'), 또는 답변 생성 후 근거 문서를 참조하여 **사실 여부를 검증(Fact-Checking)하는 후처리 단계를 도입**하는 것의 실효성과 구현 복잡도는 각각 어떻게 될까요?","답변: 
대규모 언어 모델(LLM)의 신뢰성 확보를 위해 정보 과부하 및 신뢰도 혼란 문제를 해결하는 것은 매우 중요한 과제입니다. 본문은 LLM이 제한된 컨텍스트와 최신성 부족으로 인해 환각 현상을 일으킬 수 있음을 지적하며, 이는 여러 문서에서 상충되는 정보가 주어질 때 모델의 성능 저하로 이어질 수 있는 ‘신뢰도 혼란’ 문제와 직결됩니다. 또한, 제미나이 모델처럼 컨텍스트 창이 수백만 토큰으로 확장되더라도 ‘건초 더미에서 바늘 찾기’ 문제처럼 모델이 방대한 데이터 속에서 특정 사실을 찾지 못하는 현상이 발생할 수 있습니다. 이는 검색된 컨텍스트의 양이 과도할 때 발생하는 ‘정보 과부하’ 문제의 심각성을 시사하며, 단순히 컨텍스트 창을 넓히는 것만으로는 근본적인 해결책이 될 수 없음을 보여줍니다.

제시된 완화 방안들의 실효성과 복잡도를 본문에 근거하여 분석해 볼 수 있습니다. 첫째, 컨텍스트 압축 기법은 물리적인 컨텍스트 한계를 극복하는 데 도움을 줄 수 있으나, 본문에서 언급된 ‘건초 더미에서 바늘 찾기’ 문제를 고려할 때 근본적인 해결책이라 보기는 어렵습니다. 정보를 압축하여 더 많이 입력하더라도, 정보의 밀도가 높아져 모델이 핵심 내용을 정확히 인식하고 상충되는 정보 사이에서 올바른 판단을 내리는 능력이 저하될 수 있습니다. 둘째, ‘주어진 문서만을 근거로 답변하라’와 같은 프롬프트 엔지니어링은 본문에서 제시한 해결책과 가장 유사하며 실효성이 높을 것으로 판단됩니다. 본문은 환각 방지를 위해 프롬프트에 날짜나 URL을 포함하는 방법을 제안하는데, 이는 모델의 정보 탐색 범위를 명확히 제한하여 근거 없는 답변 생성을 억제하는 원리입니다. 따라서 LLM의 역할을 명확히 지정하는 프롬프트는 모델이 학습된 내부 지식이나 무관한 정보에 의존하는 대신, 제공된 컨텍스트에만 집중하도록 유도하여 환각과 신뢰도 혼란을 효과적으로 완화할 수 있습니다.

결론적으로, 본문의 내용은 LLM이 가진 내재적 한계를 명확히 보여주며, 이를 극복하기 위한 전략의 방향성을 제시합니다. LLM이 최신 정보의 부재나 과도한 정보량으로 인해 ‘전혀 근거 없는 정보’를 생성할 수 있다는 점을 고려할 때, 답변 생성 후 근거 문서를 참조하여 사실 여부를 검증하는 후처리 단계는 필수적인 안전장치로 볼 수 있습니다. 본문은 이 단계의 구현 복잡도를 직접 언급하지 않지만, 모델의 환각 가능성을 근본적으로 인정하는 만큼, 출력의 신뢰도를 보장하기 위한 검증 과정의 도입은 논리적으로 타당합니다. 따라서 가장 실효성 있는 접근법은 명확한 역할 지정을 통한 프롬프트 엔지니어링으로 1차적인 오류를 최소화하고, 이후 사실 검증 후처리 단계를 결합하여 최종 결과물의 정확성과 신뢰도를 확보하는 다단계 전략일 것입니다.

대규모 언어 모델의 신뢰성 문제는 정보 과부하와 신뢰도 혼란이라는 근본적 한계에서 비롯되므로, 단순히 컨텍스트 창을 확장하는 것만으로는 해결할 수 없습니다. 따라서 명확한 프롬프트 엔지니어링으로 모델의 답변 범위를 제한하여 오류를 최소화하고, 생성된 결과물을 근거 문서와 비교 검증하는 후처리 단계를 결합하는 것이 중요합니다. 이러한 다단계 접근법은 LLM의 내재적 취약점을 보완하여 최종 결과물의 정확성과 신뢰도를 확보하는 가장 현실적이고 효과적인 전략이다.","[""LLM이 처리 한계를 넘어서는 정보나 모순된 내용을 다룰 때 발생하는 성능 저하 문제를 해결하기 위해, 컨텍스트 압축, '주어진 정보에만 기반하여 응답하라'와 같은 프롬프트 설계, 그리고 생성된 답변을 원문과 대조해 사실을 확인하는 후처리 과정의 실질적인 효과와 기술적 구현 난이도는 각각 어떻게 평가될 수 있습니까?"", ""대규모 언어 모델이 컨텍스트 창을 초과하는 정보량이나 내용상 불일치가 있는 데이터로 인해 성능이 저하될 때, 컨텍스트 압축, 프롬프트를 통한 역할(예: '주어진 문서에만 근거') 한정, 생성 후 사실 검증 단계 도입과 같은 해결책들의 실용적 가치와 개발 난이도를 각각 비교하면 어떻게 될까요?"", '과도한 정보 입력이나 상충되는 내용으로 인한 LLM의 성능 저하 및 신뢰도 혼란 현상을 완화하기 위한 방안으로 거론되는 컨텍스트 압축, 프롬프트를 이용한 답변 범위 제한, 답변 생성 후 사실관계 확인이라는 세 가지 기법의 유효성과 구현의 복잡성은 각각 어느 수준입니까?', 'LLM에 과도하거나 서로 충돌하는 정보가 주어졌을 때의 성능 문제를 다루기 위해, 1) 컨텍스트 압축, 2) 프롬프트로 답변 근거를 제한하는 방법, 3) 생성된 답변을 사후에 검증하는 절차를 적용한다고 할 때, 이 세 가지 접근법의 실효성과 구현상의 난점은 각각 무엇이라고 할 수 있습니까?']"
LLM 한계 극복을 위한 RAG의 역할과 최신 동향,해결책 : LLM과 사실의 그라운딩,"현재 RAG 시스템이 임베딩 기반의 단일 Dense Retriever에 의존하고 있습니다. 하지만 복잡하고 전문적인 내부 문서(e.g., 특정 에러 코드, 인물명, 고유 제품 번호) 검색 시 성능 저하가 관찰됩니다. 검색 정확도를 높이기 위해, **키워드 기반의 Sparse Retriever(e.g., BM25)를 결합한 Hybrid Search 시스템을 도입하는 것이 실질적인 성능 향상으로 이어질까요?** 이를 검증하기 위해 어떤 실험을 설계해야 하며, 두 검색 결과의 Score를 결합(Fusion)하는 최적의 전략(e.g., RRF, 가중치 합)은 무엇일까요?","답변: 본문에서 제시된 RAG(Retrieval-Augmented Generation) 시스템은 LLM의 환각 현상을 완화하고 사실에 기반한 답변을 생성하는 핵심적인 해결책으로 평가받고 있습니다. 하지만 현재 시스템이 고밀도 임베딩 벡터 기반의 단일 Dense Retriever에 의존하는 구조는 특정 에러 코드, 고유 명사, 제품 번호와 같이 의미적 유사성보다 어휘적 일치(lexical match)가 중요한 쿼리 검색에 있어 명백한 한계를 드러냅니다. 이는 임베딩이 문맥과 의미를 포착하는 데는 뛰어나지만, 특정 키워드의 중요도를 정확하게 반영하지 못하기 때문입니다. 따라서 복잡하고 전문적인 내부 문서 검색의 정확도를 실질적으로 향상시키기 위해, 키워드 기반의 Sparse Retriever를 결합한 하이브리드 검색(Hybrid Search) 시스템의 도입은 단순한 개선을 넘어 필수적인 전략으로 간주되어야 합니다.

이러한 하이브리드 검색 시스템의 실효성을 검증하기 위해서는 체계적인 실험 설계가 요구됩니다. 우선, 평가 데이터셋은 일반적인 의미 검색 쿼리와 특정 키워드(에러 코드, 인물명, 제품 번호 등)가 포함된 쿼리를 모두 포괄하도록 구성해야 합니다. 실험은 세 가지 모델, 즉 (1) 기존의 Dense Retriever (Embedding) 단독 모델, (2) Sparse Retriever (e.g., BM25) 단독 모델, (3) 두 가지를 결합한 하이브리드 검색 모델을 대상으로 진행합니다. 각 모델이 동일한 쿼리에 대해 검색한 문서들의 순위와 정확도를 Hit Rate, MRR(Mean Reciprocal Rank), NDCG(Normalized Discounted Cumulative Gain)와 같은 표준 정보 검색 평가 지표를 사용해 정량적으로 측정하고 비교 분석해야 합니다. 이 과정을 통해 하이브리드 방식이 각 단일 검색 방식의 단점을 어떻게 보완하며 전반적인 검색 성능을 얼마나 향상시키는지 객관적으로 입증할 수 있습니다.

두 검색 시스템의 결과를 효과적으로 결합(Fusion)하는 전략으로는 가중치 합(Weighted Sum)과 상호 순위 결합(Reciprocal Rank Fusion, RRF)이 대표적입니다. 가중치 합 방식은 각 검색 결과의 점수에 가중치(alpha)를 부여하여 합산하는 직관적인 방법이지만, Dense Retriever와 Sparse Retriever의 점수 분포(score distribution)가 상이하여 정규화 과정이 필요하고 최적의 가중치를 찾는 추가적인 튜닝 비용이 발생합니다. 반면 RRF는 각 문서의 순위(rank) 정보만을 활용하여 최종 점수를 계산하므로, 별도의 정규화나 복잡한 파라미터 튜닝 없이도 안정적으로 우수한 성능을 보이는 경향이 있습니다. 따라서 초기 도입 시에는 구현이 용이하고 성능이 안정적인 RRF를 우선적으로 고려하는 것이 합리적입니다. 궁극적으로 하이브리드 검색 시스템은 RAG의 정보 검색 단계를 고도화하여, 본문이 목표하는 ‘LLM과 사실의 그라운딩’을 더욱 강화하고 신뢰도 높은 AI 시스템을 구축하는 핵심 동력이 될 것입니다.

이처럼 체계적인 실험을 통해 하이브리드 검색의 우수성을 입증하고 RRF와 같은 효율적인 결합 전략을 적용하는 것은, 기존 RAG 시스템의 명백한 한계를 극복하기 위한 구체적인 실행 방안입니다. 이는 의미적 유사성과 어휘적 정확성을 동시에 충족시켜 검색 품질을 극대화하고, 사용자 의도에 더욱 정밀하게 부합하는 결과를 제공할 것입니다. 궁극적으로 이러한 검색 성능의 고도화는 LLM이 생성하는 답변의 사실적 기반을 견고히 하여, 전문 지식이 요구되는 환경에서도 신뢰도 높은 AI 시스템을 구현하는 결정적 토대가 된다.","['벡터 검색에만 의존하는 RAG 파이프라인에서 에러 코드나 인명 같은 특정 정보 검색률이 낮습니다. BM25와 같은 텍스트 기반 검색을 통합하는 하이브리드 방식으로 이 문제를 해결하려 할 때, 이 결정의 효과를 입증할 평가 지표와 실험 절차는 어떻게 수립해야 할까요? 더불어, 두 리트리버의 점수를 결합하는 최적의 퓨전 메커니즘(RRF, 가중치 합 등)을 찾는 방법론은 무엇입니까?', '의미 기반 검색만 사용하는 현재 RAG 시스템이 고유 제품 번호와 같은 키워드성 정보 검색에 어려움을 겪고 있습니다. 키워드 검색(e.g., BM25)을 추가하는 하이브리드 아키텍처가 실제로 검색 정확도를 향상시킬 수 있는지, 그리고 이를 검증하기 위한 실험 설계와 두 검색 점수를 융합(e.g., RRF, 가중치 합)하는 최적의 방법론은 무엇일까요?', 'Dense Retriever만으로는 특정 에러 코드, 인물명 등의 내부 전문 용어 검색 정확도에 한계가 있습니다. Sparse Retriever를 통합한 하이브리드 검색 시스템으로의 전환이 유의미한 성능 개선을 가져올지 확인하려면 어떤 실험을 구성해야 하며, RRF나 가중치 합 같은 다양한 퓨전 전략 중 최적의 선택지를 결정하기 위한 기준은 무엇인가요?']"
